<?xml version="1.0" encoding="UTF-8"?>
<!-- edited with XML Spy v3.0 (http://www.xmlspy.com) by gr (gr) -->
<!--simple test configuration for the new tracker serve system-->
<!DOCTYPE OpenTracker SYSTEM "opentracker.dtd">
<OpenTracker>
	<configuration>
		<NetworkSinkConfig name="Test Server"/>
		<ConsoleConfig interval="20"/>
	</configuration>
	<NetworkSink name="test station 1" number="1" multicast-address="224.100.200.102" port="12347">
		<ConsoleSink comment="Test Console Output">
			<EventTransformation translation="0 0 2">
				<TestSource frequency="10"/>
			</EventTransformation>
		</ConsoleSink>
	</NetworkSink>
</OpenTracker>
