<?xml version="1.0" encoding="UTF-8"?>
<!DOCTYPE OpenTracker SYSTEM "opentracker.dtd">
<OpenTracker>
  <configuration>
    <ConsoleConfig headerline="Network Test Client - VisCenter@ICG" interval="1"/>
  </configuration>
  <ConsoleSink comment="NetworkSource 0">
      <NetworkSource  mode="unicast" address="129.27.201.31" number="0"
      multicast-address="224.100.200.101" port="12346" />
  </ConsoleSink>
  <ConsoleSink comment="NetworkSource 1">
      <NetworkSource  mode="unicast" address="129.27.201.31" number="1"
      multicast-address="224.100.200.101" port="12346" />
  </ConsoleSink>
  <ConsoleSink comment="NetworkSource 2">
      <NetworkSource  mode="unicast" address="129.27.201.31" number="2"
      multicast-address="224.100.200.101" port="12346" />
  </ConsoleSink>
  <ConsoleSink comment="NetworkSource 3">
      <NetworkSource  mode="unicast" address="129.27.201.31" number="3"
      multicast-address="224.100.200.101" port="12346" />
  </ConsoleSink>
  <ConsoleSink comment="NetworkSource 4">
      <NetworkSource  mode="unicast" address="129.27.201.31" number="4"
      multicast-address="224.100.200.101" port="12346" />
  </ConsoleSink>
  <ConsoleSink comment="NetworkSource 5">
      <NetworkSource  mode="unicast" address="129.27.201.31" number="5"
      multicast-address="224.100.200.101" port="12346" />
  </ConsoleSink>
</OpenTracker>
